{
  "version": 2,
  "session_id": "00000000-0000-4000-8000-000000000052",
  "seq": 0,
  "type": "user.message",
  "time": "2026-10-23T00:00:00.000000Z",
  "source": {
    "kind": "request",
    "step_id": null,
    "invocation_id": null
  },
  "content_policy": "public-v1",
  "redacted": false,
  "data": {
    "content": "积木验证 Unicode 🧱，核查历史内容。"
  }
}
